{
  "$schema": "../../skin.schema.json",
  "author": "Sound Scraper",
  "colors": {
    "accent": "#ffb24a",
    "aluminum": "#c9c8c2",
    "amber": "#ffb24a",
    "amberGhost": "#ffb24a1f",
    "amberHot": "#ffd98a",
    "background": "#c9c8c2",
    "cream": "#f1e3c2",
    "panel": "#1b1511",
    "phosphor": "#6dff9a",
    "phosphorGhost": "#6dff9a24",
    "phosphorHot": "#d2ffe0",
    "record": "#e0402a",
    "text": "#1e1a16",
    "walnut": "#4a2b17"
  },
  "description": "A 1970s stereo receiver: brushed aluminum, screwed-on black modules, an enamel nameplate, a flip-card clock, pilot lamps, label tape, a phosphor scope and needle VU meters.",
  "fonts": {
    "dymo": {
      "cell": [
        8,
        12
      ],
      "glyphs": " ABCDEFGHIJKLMNOPQRSTUVWXYZ0123456789.,:;!?'\"-+/()[]&#%@*_<>=$~|●▶■⏸♪▼",
      "sprite": "font-dymo.png"
    },
    "flip": {
      "cell": [
        18,
        30
      ],
      "glyphs": "0123456789:.- ",
      "sprite": "flip.png"
    },
    "flipSmall": {
      "cell": [
        8,
        12
      ],
      "glyphs": "0123456789:.- ",
      "sprite": "flip-small.png"
    },
    "label": {
      "cell": [
        8,
        12
      ],
      "glyphs": " ABCDEFGHIJKLMNOPQRSTUVWXYZabcdefghijklmnopqrstuvwxyz0123456789.,:;!?'\"-+/()[]&#%@*_<>=$~|●▶■⏸♪▼",
      "sprite": "font-label.png"
    }
  },
  "format": 1,
  "id": "com.alexboyce.soundscraper.hifi74",
  "name": "Hi-Fi '74",
  "panels": {
    "burn": {
      "close": {
        "offset": [
          12,
          7
        ],
        "size": [
          14,
          10
        ],
        "sprite": {
          "image": "buttons.png",
          "states": {
            "normal": [
              704,
              60
            ],
            "pressed": [
              718,
              60
            ]
          }
        }
      },
      "controls": {
        "accent": "@amber",
        "background": "#241b15",
        "border": "#4a3a2c",
        "button": "@aluminum",
        "buttonText": "@text",
        "text": "@cream"
      },
      "frame": {
        "image": "frame.png",
        "slice": [
          24,
          8,
          8,
          8
        ]
      },
      "grip": [
        14,
        14
      ],
      "minSize": [
        480,
        360
      ],
      "progress": {
        "bar": "@phosphor",
        "buffer": "@amber",
        "done": "@phosphor",
        "failed": "@record",
        "glow": "#ffb24a55",
        "log": "#0b0806",
        "logText": "@phosphor",
        "preparing": "#8a6a3a",
        "track": "#0f0b08",
        "waiting": "#3a2d22",
        "writing": "@amber"
      },
      "resizable": true,
      "table": {
        "alternate": "#221a14",
        "background": "#1b1511",
        "grid": "#3a2d22",
        "header": "@aluminum",
        "headerText": "@text",
        "selection": "@amber",
        "selectionText": "#1b1108",
        "text": "@cream"
      },
      "title": {
        "background": "#0000",
        "font": "label",
        "offset": [
          14,
          6
        ]
      }
    },
    "details": {
      "close": {
        "offset": [
          12,
          7
        ],
        "size": [
          14,
          10
        ],
        "sprite": {
          "image": "buttons.png",
          "states": {
            "normal": [
              704,
              60
            ],
            "pressed": [
              718,
              60
            ]
          }
        }
      },
      "controls": {
        "accent": "@amber",
        "background": "#241b15",
        "border": "#4a3a2c",
        "button": "@aluminum",
        "buttonText": "@text",
        "text": "@cream"
      },
      "frame": {
        "image": "frame.png",
        "slice": [
          24,
          8,
          8,
          8
        ]
      },
      "grip": [
        14,
        14
      ],
      "menu": {
        "offset": [
          28,
          7
        ],
        "size": [
          14,
          10
        ],
        "sprite": {
          "image": "buttons.png",
          "states": {
            "normal": [
              0,
              90
            ],
            "pressed": [
              14,
              90
            ]
          }
        }
      },
      "minSize": [
        240,
        320
      ],
      "resizable": true,
      "title": {
        "background": "#0000",
        "font": "label",
        "offset": [
          14,
          6
        ]
      }
    },
    "editor": {
      "close": {
        "offset": [
          12,
          7
        ],
        "size": [
          14,
          10
        ],
        "sprite": {
          "image": "buttons.png",
          "states": {
            "normal": [
              704,
              60
            ],
            "pressed": [
              718,
              60
            ]
          }
        }
      },
      "controls": {
        "accent": "@amber",
        "background": "#241b15",
        "border": "#4a3a2c",
        "button": "@aluminum",
        "buttonText": "@text",
        "text": "@cream"
      },
      "frame": {
        "image": "frame.png",
        "slice": [
          24,
          8,
          8,
          8
        ]
      },
      "grip": [
        14,
        14
      ],
      "minSize": [
        640,
        430
      ],
      "resizable": true,
      "table": {
        "alternate": "#221a14",
        "background": "#1b1511",
        "grid": "#3a2d22",
        "header": "@aluminum",
        "headerText": "@text",
        "selection": "@amber",
        "selectionText": "#1b1108",
        "text": "@cream"
      },
      "title": {
        "background": "#0000",
        "font": "label",
        "offset": [
          14,
          6
        ]
      },
      "waveform": {
        "background": "#06110a",
        "center": "#1d3a27",
        "deleted": "#000000a8",
        "playhead": "@record",
        "rms": "@phosphor",
        "ruler": "#1f1c19",
        "rulerText": "@cream",
        "selection": "#ffffff26",
        "splice": "@amber",
        "spliceSelected": "@amberHot",
        "wave": "#2f8a4e"
      }
    },
    "library": {
      "close": {
        "offset": [
          12,
          7
        ],
        "size": [
          14,
          10
        ],
        "sprite": {
          "image": "buttons.png",
          "states": {
            "normal": [
              704,
              60
            ],
            "pressed": [
              718,
              60
            ]
          }
        }
      },
      "controls": {
        "accent": "@amber",
        "background": "#241b15",
        "border": "#4a3a2c",
        "button": "@aluminum",
        "buttonText": "@text",
        "text": "@cream"
      },
      "frame": {
        "image": "frame.png",
        "slice": [
          24,
          8,
          8,
          8
        ]
      },
      "grip": [
        14,
        14
      ],
      "minSize": [
        400,
        240
      ],
      "playlist": {
        "fill": "@phosphor",
        "fill80": "@amber",
        "handle": "#7a6a58",
        "insert": "@amber",
        "mark": "@cream",
        "missing": "#6d5f50",
        "over": "@record",
        "text": "@cream",
        "track": "#0f0b08"
      },
      "resizable": true,
      "scrollbar": {
        "image": "scrollbar.png",
        "thumb": [
          12,
          0,
          10,
          24
        ],
        "thumbSlice": [
          4,
          0,
          4,
          0
        ],
        "track": [
          0,
          0,
          10,
          32
        ]
      },
      "table": {
        "alternate": "#221a14",
        "background": "#1b1511",
        "grid": "#3a2d22",
        "header": "@aluminum",
        "headerText": "@text",
        "selection": "@amber",
        "selectionText": "#1b1108",
        "text": "@cream"
      },
      "title": {
        "background": "#0000",
        "font": "label",
        "offset": [
          14,
          6
        ]
      }
    },
    "main": {
      "animations": [
        {
          "fps": 2,
          "frames": [
            "on",
            "off"
          ],
          "name": "recLamp",
          "play": "recording",
          "rect": [
            328,
            112,
            12,
            12
          ],
          "sprite": {
            "image": "buttons.png",
            "states": {
              "off": [
                232,
                90
              ],
              "on": [
                244,
                90
              ]
            }
          }
        }
      ],
      "background": "main.png",
      "dragRegion": [
        [
          0,
          0,
          460,
          186
        ]
      ],
      "elements": {
        "close": {
          "rect": [
            430,
            6,
            14,
            10
          ],
          "sprite": {
            "image": "buttons.png",
            "states": {
              "normal": [
                704,
                60
              ],
              "pressed": [
                718,
                60
              ]
            }
          }
        },
        "elapsed": {
          "align": "right",
          "font": "flip",
          "rect": [
            33,
            34,
            108,
            30
          ],
          "style": {
            "flip": true,
            "tenths": false
          }
        },
        "levels": {
          "rect": [
            258,
            28,
            176,
            72
          ],
          "style": {
            "faces": 2,
            "gap": 6.0,
            "kind": "needle",
            "length": 82.0,
            "needle": "#1a120a",
            "pivot": [
              42.5,
              98.0
            ],
            "range": [
              -20.0,
              3.0
            ],
            "reference": -16.0,
            "sweep": 64.0,
            "tip": "#b02a1c",
            "width": 1.2
          }